{
  "schemaVersion": "1.0.0",
  "id": "taping-fieldwork",
  "version": "0.1.0",
  "title": "Taping Fieldwork",
  "description": "Explore taping procedures and horizontal-distance measurement.",
  "category": "surveying",
  "topics": [
    "taping",
    "distance-measurement"
  ],
  "learningObjectives": [
    "Explore taping procedures and horizontal-distance measurement."
  ],
  "kind": "presentation",
  "renderer": "unknown",
  "status": "candidate",
  "entrypoint": "examples/surveying/taping-fieldwork/index.html",
  "readme": "examples/surveying/taping-fieldwork/README.md",
  "previewImage": null,
  "reviewFile": null,
  "derivedFrom": null,
  "networkRequired": null,
  "dependencies": [],
  "rights": {
    "status": "needs-confirmation",
    "licenseExpression": null,
    "licenseFile": null,
    "attribution": "User-supplied example; upstream authorship and reuse terms require confirmation."
  },
  "verification": {
    "engineeringReview": "not-reviewed",
    "browserReview": "not-reviewed",
    "accessibilityReview": "not-reviewed",
    "notes": "Original source extracted without changes. Metadata and byte integrity checked; runtime and engineering behavior not verified."
  },
  "source": {
    "type": "user-supplied",
    "reference": "Pasted text(20260921-161408).txt, HTML document 2",
    "sha256": "db079c5b09d78e9b3a714372a6c2779c1a3718d57bb8490990ea3686a6fd1842"
  }
}
