{
  "schemaVersion": "1.0.0",
  "id": "geo-tank-reservoir",
  "version": "0.1.0",
  "title": "Tank storage: inlet/outlet mass balance",
  "description": "Reusable SVG tank/reservoir component that samples constant inlet/outlet storage balance in absolute time, with explicit full-tank overflow and empty-tank supply-shortfall behavior.",
  "category": "hydraulics-and-hydrology",
  "topics": [
    "tank storage",
    "reservoir",
    "mass balance",
    "continuity",
    "inflow and outflow"
  ],
  "learningObjectives": [
    "Apply dV/dt = Qin − Qout to a constant-area tank.",
    "Recognize how physical storage limits convert excess inflow to overflow or unmet outlet demand at an empty tank."
  ],
  "kind": "component",
  "renderer": "threejs",
  "status": "candidate",
  "entrypoint": "assets/hydraulics-and-hydrology/geo-tank-reservoir/demo/index.html",
  "readme": "assets/hydraulics-and-hydrology/geo-tank-reservoir/README.md",
  "previewImage": null,
  "reviewFile": "assets/hydraulics-and-hydrology/geo-tank-reservoir/REVIEW.md",
  "derivedFrom": null,
  "networkRequired": true,
  "dependencies": [
    {
      "name": "three",
      "version": "0.185.1",
      "url": "https://cdn.jsdelivr.net/npm/three@0.185.1/build/three.module.js",
      "embedded": false
    }
  ],
  "rights": {
    "status": "cleared",
    "licenseExpression": "MIT",
    "licenseFile": "LICENSE",
    "attribution": "Original LearnMat repository contribution."
  },
  "verification": {
    "engineeringReview": "passed",
    "browserReview": "not-reviewed",
    "accessibilityReview": "not-reviewed",
    "notes": "Rebuilt as a real Three.js reservoir/tank storage scene; mass-balance model retained. Rendered visual comparison pending."
  },
  "source": {
    "type": "original",
    "reference": "Original LearnMat water-ground asset contribution, 2026-09-22.",
    "sha256": null
  }
}
