{
  "schemaVersion": "1.0.0",
  "id": "sur-tape-team",
  "version": "0.2.0",
  "title": "Surveying Tape Team",
  "description": "Two-person 3D tape-handling field scene comparing a straight reference with the physically computed catenary.",
  "category": "surveying",
  "topics": [
    "taping",
    "distance-measurement",
    "sag",
    "fieldwork",
    "3d"
  ],
  "learningObjectives": [
    "Distinguish horizontal endpoint span from the curved length of a sagging tape.",
    "Relate tape mass and horizontal tension to the actual 3D catenary sag."
  ],
  "kind": "component",
  "renderer": "threejs",
  "status": "in-review",
  "entrypoint": "assets/surveying/sur-tape-team/demo/index.html",
  "readme": "assets/surveying/sur-tape-team/README.md",
  "previewImage": null,
  "reviewFile": "assets/surveying/sur-tape-team/REVIEW.md",
  "derivedFrom": null,
  "networkRequired": true,
  "dependencies": [
    {
      "name": "three",
      "version": "0.185.1",
      "url": "https://cdn.jsdelivr.net/npm/three@0.185.1/build/three.module.js",
      "embedded": false
    }
  ],
  "rights": {
    "status": "cleared",
    "licenseExpression": "MIT",
    "licenseFile": "LICENSE",
    "attribution": "Original LearnMat procedural geometry; no third-party models or textures."
  },
  "verification": {
    "engineeringReview": "passed",
    "browserReview": "not-reviewed",
    "accessibilityReview": "not-reviewed",
    "notes": "Catenary model preserved and rebuilt as true 3D geometry; live rendered/browser/accessibility evidence remains pending."
  },
  "source": {
    "type": "original",
    "reference": "Reserved surveying queue task sur-tape-team; 3D remediation of merged PR #15.",
    "sha256": null
  }
}
