{
  "schemaVersion": "1.0.0",
  "id": "geo-soil-layers",
  "version": "0.1.0",
  "title": "Layered soil profile and effective vertical stress",
  "description": "Reusable SVG soil-profile component with three configurable layers, water-table location, and total/pore/effective vertical stress at a query depth.",
  "category": "geotechnical",
  "topics": [
    "soil layers",
    "water table",
    "total stress",
    "pore pressure",
    "effective stress"
  ],
  "learningObjectives": [
    "Integrate vertical overburden stress through layered soils using stated natural and saturated unit weights.",
    "Apply Terzaghi effective stress σ′v = σv − u below a hydrostatic water table."
  ],
  "kind": "component",
  "renderer": "threejs",
  "status": "candidate",
  "entrypoint": "assets/geotechnical/geo-soil-layers/demo/index.html",
  "readme": "assets/geotechnical/geo-soil-layers/README.md",
  "previewImage": null,
  "reviewFile": "assets/geotechnical/geo-soil-layers/REVIEW.md",
  "derivedFrom": null,
  "networkRequired": true,
  "dependencies": [
    {
      "name": "three",
      "version": "0.185.1",
      "url": "https://cdn.jsdelivr.net/npm/three@0.185.1/build/three.module.js",
      "embedded": false
    }
  ],
  "rights": {
    "status": "cleared",
    "licenseExpression": "MIT",
    "licenseFile": "LICENSE",
    "attribution": "Original LearnMat repository contribution."
  },
  "verification": {
    "engineeringReview": "passed",
    "browserReview": "not-reviewed",
    "accessibilityReview": "not-reviewed",
    "notes": "Rebuilt as a real Three.js cutaway soil block with water-table and stress markers; independent rendered comparison pending."
  },
  "source": {
    "type": "original",
    "reference": "Original LearnMat water-ground contribution, 2026-09-22.",
    "sha256": null
  }
}
