{
  "schemaVersion":"1.0.0","id":"sur-prism-pole","version":"0.2.0",
  "title":"3D Prism Pole Carrier",
  "description":"Articulated 3D surveyor with striped prism pole, volumetric reflector target, target height, and pole verticality error.",
  "category":"surveying","topics":["total-station","prism-pole","target-height","verticality","3d"],
  "learningObjectives":["Identify prism target height from ground point to reflector center.","Relate pole tilt to horizontal target offset and reduced vertical projection in 3D."],
  "kind":"component","renderer":"threejs","status":"in-review",
  "entrypoint":"assets/surveying/sur-prism-pole/demo/index.html","readme":"assets/surveying/sur-prism-pole/README.md",
  "previewImage":null,"reviewFile":"assets/surveying/sur-prism-pole/REVIEW.md","derivedFrom":null,"networkRequired":true,
  "dependencies":[{"name":"three","version":"0.185.1","url":"https://cdn.jsdelivr.net/npm/three@0.185.1/build/three.module.js","embedded":false}],
  "rights":{"status":"cleared","licenseExpression":"MIT","licenseFile":"LICENSE","attribution":"Original LearnMat procedural geometry; no third-party models or textures."},
  "verification":{"engineeringReview":"passed","browserReview":"not-reviewed","accessibilityReview":"not-reviewed","notes":"Target-height/tilt model preserved in real Three.js geometry; live rendered/browser/accessibility evidence remains pending."},
  "source":{"type":"original","reference":"Reserved surveying queue task sur-prism-pole; 3D remediation of merged PR #15.","sha256":null}
}