{
  "schemaVersion": "1.0.0",
  "id": "str-support-reactions",
  "version": "0.3.2",
  "title": "Support reactions and restraints",
  "description": "Three.js support-restraint study with ordered leader annotations, progressive parameters, in-scene display toggles, and corrected focus-mode controls.",
  "category": "structural-analysis",
  "topics": [
    "support-reactions",
    "boundary-conditions",
    "degrees-of-freedom",
    "3d-visualization",
    "leader-annotations"
  ],
  "learningObjectives": [
    "Distinguish restrained degrees of freedom and admissible reaction components for common planar structural supports using a spatial model."
  ],
  "kind": "component",
  "renderer": "threejs",
  "status": "candidate",
  "entrypoint": "assets/structural-analysis/str-support-reactions/demo/index.html",
  "readme": "assets/structural-analysis/str-support-reactions/README.md",
  "previewImage": null,
  "reviewFile": "assets/structural-analysis/str-support-reactions/REVIEW.md",
  "derivedFrom": null,
  "networkRequired": true,
  "dependencies": [
    {
      "name": "three",
      "version": "0.185.1",
      "url": "https://cdn.jsdelivr.net/npm/three@0.185.1/",
      "embedded": false
    }
  ],
  "rights": {
    "status": "cleared",
    "licenseExpression": "MIT",
    "licenseFile": "LICENSE",
    "attribution": "Original LearnMat repository contribution. Runtime uses the declared Three.js 0.185.1 peer; no third-party models, textures, fonts, or datasets are embedded."
  },
  "verification": {
    "engineeringReview": "not-reviewed",
    "browserReview": "not-reviewed",
    "accessibilityReview": "not-reviewed",
    "notes": "0.3.2 adds independent Information and Labels visibility controls and fixes Focus View menu contrast while preserving the analytical model and ordered leader system. Independent engineering, live-browser, and accessibility review remain required before approval."
  },
  "source": {
    "type": "original",
    "reference": "Leader-annotation remediation of the Three.js support reactions asset; analytical model retained from the original repository contribution.",
    "sha256": null
  }
}
