{
  "schemaVersion": "1.0.0",
  "id": "geo-slope-profile",
  "version": "0.1.0",
  "title": "Slope profile with scoped infinite-slope stability model",
  "description": "Reusable SVG slope geometry component with a clearly stated planar infinite-slope force model using normal soil thickness, cohesion, friction angle, unit weight, and a pore-pressure ratio.",
  "category": "geotechnical",
  "topics": [
    "slope geometry",
    "infinite slope",
    "factor of safety",
    "effective stress",
    "pore pressure"
  ],
  "learningObjectives": [
    "Relate slope rise/run to inclination and slope length.",
    "Evaluate a simplified planar infinite-slope factor of safety while distinguishing it from circular-slip or full limit-equilibrium analysis."
  ],
  "kind": "component",
  "renderer": "threejs",
  "status": "candidate",
  "entrypoint": "assets/geotechnical/geo-slope-profile/demo/index.html",
  "readme": "assets/geotechnical/geo-slope-profile/README.md",
  "previewImage": null,
  "reviewFile": "assets/geotechnical/geo-slope-profile/REVIEW.md",
  "derivedFrom": null,
  "networkRequired": true,
  "dependencies": [
    {
      "name": "three",
      "version": "0.185.1",
      "url": "https://cdn.jsdelivr.net/npm/three@0.185.1/build/three.module.js",
      "embedded": false
    }
  ],
  "rights": {
    "status": "cleared",
    "licenseExpression": "MIT",
    "licenseFile": "LICENSE",
    "attribution": "Original LearnMat repository contribution."
  },
  "verification": {
    "engineeringReview": "passed",
    "browserReview": "not-reviewed",
    "accessibilityReview": "not-reviewed",
    "notes": "Rebuilt as a real Three.js terrain wedge with a scoped planar infinite-slope slice; independent rendered comparison pending."
  },
  "source": {
    "type": "original",
    "reference": "Original LearnMat water-ground contribution, 2026-09-22.",
    "sha256": null
  }
}
