{
  "schemaVersion": "1.0.0",
  "id": "geo-seepage-section",
  "version": "0.1.0",
  "title": "1-D seepage section with fixed-head boundaries",
  "description": "Reusable SVG Darcy-seepage component for a homogeneous soil section with explicit upstream/downstream total-head boundaries, hydraulic gradient, Darcy flux, and discharge.",
  "category": "geotechnical",
  "topics": [
    "seepage",
    "Darcy law",
    "hydraulic gradient",
    "total head",
    "fixed-head boundary"
  ],
  "learningObjectives": [
    "Compute signed hydraulic gradient from stated total-head boundary conditions.",
    "Apply Darcy's law to obtain specific discharge and section discharge without misrepresenting the result as a two-dimensional flow net."
  ],
  "kind": "component",
  "renderer": "threejs",
  "status": "candidate",
  "entrypoint": "assets/geotechnical/geo-seepage-section/demo/index.html",
  "readme": "assets/geotechnical/geo-seepage-section/README.md",
  "previewImage": null,
  "reviewFile": "assets/geotechnical/geo-seepage-section/REVIEW.md",
  "derivedFrom": null,
  "networkRequired": true,
  "dependencies": [
    {
      "name": "three",
      "version": "0.185.1",
      "url": "https://cdn.jsdelivr.net/npm/three@0.185.1/build/three.module.js",
      "embedded": false
    }
  ],
  "rights": {
    "status": "cleared",
    "licenseExpression": "MIT",
    "licenseFile": "LICENSE",
    "attribution": "Original LearnMat repository contribution."
  },
  "verification": {
    "engineeringReview": "passed",
    "browserReview": "not-reviewed",
    "accessibilityReview": "not-reviewed",
    "notes": "Rebuilt as a real Three.js fixed-head seepage section with representative 1-D tracks; independent rendered comparison pending."
  },
  "source": {
    "type": "original",
    "reference": "Original LearnMat water-ground contribution, 2026-09-22.",
    "sha256": null
  }
}
